Key,Item Type,Publication Year,Author,Title,Publication Title,ISBN,Date,Date Added,Date Modified,Num Pages,Short Title,Publisher,Place,Lat/Long,Library Catalog,Call Number,Link Attachments,Manual Tags,Editor
UKMS74IA,book,1993,,Negotiation: strategies for mutual gain: the basic seminar of the Harvard Program on Negotiation,,978-0-8039-4849-5 978-0-8039-4850-1,1993,2025-04-28 19:46:22,2025-04-28 19:52:55,212,Negotiation,Sage Publications,"Newbury Park, Calif","34.183671,-118.91183",Library Catalog (Blacklight),BF637.N4 N44 1993,https://catalog.libraries.psu.edu/catalog/1878753,Physical,"Hall, Lavinia"
K53LQSRH,book,1995,"Nierenberg, Gerard I.",The art of negotiating: psychological strategies for gaining advantageous bargains,,978-1-56619-816-5,1995,2025-04-28 19:46:56,2025-04-28 19:53:52,195,The art of negotiating,Barnes & Noble Books,New York,"40.7127281,-74.0060152",Library Catalog (Blacklight),158.5,https://catalog.libraries.psu.edu/catalog/3862692,Physical,
9YQMS6E2,book,1981,"Pruitt, Dean G.",Negotiation behavior,,978-0-12-566250-5,1981,2025-04-28 19:47:11,2025-04-28 19:52:47,263,,Academic Press,New York,"40.7127281,-74.0060152",Library Catalog (Blacklight),BF637.N4 P78,https://catalog.libraries.psu.edu/catalog/986869,Physical,
URAUUCHH,book,1964,"Brown, J. A. C.","Techniques of persuasion, from propaganda to brainwashing",,,1964,2025-04-28 19:47:36,2025-04-28 19:53:46,325,,Penguin Books,Baltimore,"39.2908816,-76.610759",Library Catalog (Blacklight),BF637.P4 B7,https://catalog.libraries.psu.edu/catalog/1167314,Physical,
I28IBWR4,book,1966,"Fotheringham, Wallace C.",Perspectives on persuasion,,,1966,2025-04-28 19:47:49,2025-04-28 19:53:01,278,,Allyn and Bacon,Boston,"42.3554334,-71.060511",Library Catalog (Blacklight),BF637.P4 F6,https://catalog.libraries.psu.edu/catalog/1117589,Physical,
78VKFHH4,book,1979,"Larson, Charles U.",Persuasion: reception and responsibility,,978-0-534-00689-1,1979,2025-04-28 19:48:07,2025-04-28 19:53:13,292,Persuasion,Wadsworth Pub. Co,"Belmont, Calif","37.5164926,-122.2941914",Library Catalog (Blacklight),BF637.P4 L36 1979,https://catalog.libraries.psu.edu/catalog/632562,Physical,
URKVNDTY,book,1982,"Suls, Jerry M.",Psychological perspectives on the self,,978-0-89859-197-2 978-0-89859-276-4 978-0-8058-1181-0,1982,2025-04-28 19:48:21,2025-04-28 19:53:18,,,Lawrence Erlbaum Associates,"Hillsdale, N.J","41.0025975,-74.0404175",Library Catalog (Blacklight),BF697 .S925,https://catalog.libraries.psu.edu/catalog/834457,Physical,
CBJA5E4D,book,2005,"Seigel, Jerrold E.",The idea of the self: thought and experience in western Europe since the seventeenth century,,978-0-521-84417-8 978-0-521-60554-0,2005,2025-04-28 19:49:41,2025-04-28 19:53:58,724,The idea of the self,Cambridge University Press,Cambridge ; New York,"43.007994,-73.4392637",Library Catalog (Blacklight),BF697 .S45 2005,https://catalog.libraries.psu.edu/catalog/2812033,Physical,
DV5GFD2D,book,2002,,Self and motivation: emerging psychological perspectives,,978-1-55798-883-6,2002,2025-04-28 19:50:46,2025-04-28 19:53:26,226,Self and motivation,American Psychological Association,"Washington, DC","38.8950368,-77.0365427",Library Catalog (Blacklight),BF697 .S425 2002,https://catalog.libraries.psu.edu/catalog/2287972,Physical,"Tesser, Abraham; Stapel, Diederik A.; Wood, Joanne V."
MU2F2WWR,book,1999,,Self-defined,,978-1-55670-937-1,1999,2025-04-28 19:51:24,2025-04-28 19:53:37,207,,"Stewart, Tabori & Chang",New York,"40.7127281,-74.0060152",Library Catalog (Blacklight),BF697 .S4334 1999,https://catalog.libraries.psu.edu/catalog/2018353,Physical,
L5VCDWFS,book,1977,,"Negotiations, social-psychological perspectives",,978-0-8039-0829-1,1977,2025-04-28 20:05:15,2025-04-28 20:05:43,416,,Sage Publications,Beverly Hills,"34.0696501,-118.3963062",Library Catalog (Blacklight),,https://catalog.libraries.psu.edu/catalog/1342101,interlibrary,"Druckman, Daniel"
FUK8DPER,book,1993,"Pruitt, Dean G.; Carnevale, Peter J.",Negotiation in social conflict,,978-0-534-20689-5,1993,2025-04-28 20:07:04,2025-04-28 20:07:19,251,,Brooks/Cole Pub. Co,"Pacific Grove, Calif","36.6211149,-121.917794",Library Catalog (Blacklight),BF637.N4 P79 1993,https://catalog.libraries.psu.edu/catalog/1770182,interlibrary,
4ZBR9T5B,book,1976,"Murphy, Lois Barclay; Moriarty, Alice Ewell","Vulnerability, coping, and growth: from infancy to adolescence",,978-0-300-01901-8,1976,2025-04-28 20:07:45,2025-04-28 20:07:53,460,"Vulnerability, coping, and growth",Yale University Press,New Haven,"41.3082138,-72.9250518",Library Catalog (Blacklight),BF721 .M863 1976,https://catalog.libraries.psu.edu/catalog/632666,interlibrary,
7KYC4TI3,book,2007,"Nelson, Katherine","Young minds in social worlds: experience, meaning, and memory",,978-0-674-02335-2,2007,2025-04-28 20:08:15,2025-04-28 20:08:35,315,Young minds in social worlds,Harvard University Press,"Cambridge, Mass","42.3786343,-71.131738",Library Catalog (Blacklight),BF721 .N42 2007,https://catalog.libraries.psu.edu/catalog/3655828,interlibrary,
IMTJN6AP,book,1987,,Critical theories of psychological development,,978-0-306-42431-1,1987,2025-04-28 20:09:12,2025-04-28 20:09:19,313,,Plenum Press,New York,"40.7127281,-74.0060152",Library Catalog (Blacklight),BF722 .C73 1987,https://catalog.libraries.psu.edu/catalog/1364268,interlibrary,"Broughton, John M."
EWQNJDYH,book,1980,"Fadely, Jack L.; Hosler, Virginia N.",Developmental psychometrics: a resources book for mental health workers and educators,,978-0-398-04056-7 978-0-398-04057-4,1980,2025-04-28 20:09:35,2025-04-28 20:09:58,158,Developmental psychometrics,C. C. Thomas,"Springfield, Ill","39.7990175,-89.6439575",Library Catalog (Blacklight),BF722 .F32,https://catalog.libraries.psu.edu/catalog/777253,interlibrary,
96U87FZ5,webpage,,"LTD, Scotwork UK",The Psychology of Negotiation,Scotwork,,,2025-04-28 20:12:00,2025-04-28 20:12:11,,,,,,,,,web,
A8K9BAP9,webpage,,,The Psychology of Negotiation: Building Win-Win Relationships,,,,2025-04-28 20:12:29,2025-04-28 20:12:37,,The Psychology of Negotiation,,,,,,,web,
U6Z6CAHC,webpage,2024,"Mclean, Georgie",Four Psychological Tactics for Effective Negotiation,ENS,,2024-05-03,2025-04-28 20:12:53,2025-04-28 20:13:01,,,,,,,,,web,
QPPXUAAN,blogPost,2024,"Cooper, Colin",The Psychology of Negotiation: Strategies for Effective Communication and Conflict Resolution in…,Medium,,2024-01-19,2025-04-28 20:13:19,2025-04-28 20:13:27,,The Psychology of Negotiation,,,,,,,web,